q_num,q_lbl_cat,q_lbl_eng,reverse
1,Les noves idees i nous projectes algunes vegades em distreuen dels anteriors,New ideas and projects sometimes distract me from previous ones,1
2,Els contratemps (endarreriments i obstacles) no em desanimen. Em recupero de les decepcions més ràpid que la majoria de gent,"Setbacks (delays and obstacles) don’t discourage me. I bounce back from disappointments faster
than most people",0
3,M’obsessiono amb una idea o projecte per un curt període de temps però després perdo l’interès,I have been obsessed with a certain idea or project for a short time but later lost interest,1
4,Sóc molt treballador o treballadora,I am a hard worker,0
5,Algunes vegades em marco un objectiu però després decideixo perseguir-ne un de diferent,I often set a goal but later choose to pursue (follow) a different one,1
6,Tinc dificultats per mantenir la meva concentració amb projectes que duren uns quants mesos,I have difficulty maintaining (keeping) my focus on projects that take more than a few months to complete.,1
7,Acabo tot el que començo,I finish whatever I begin,0
8,Sóc diligent (molt treballador i curós amb el que faig),I am diligent (hard working and careful),0
